{
  "contractVersion": "1.0.0",
  "snapshotId": "cex-fc1e060-20260906-owner-reviewed",
  "repository": {
    "name": "cex-market-data-quality-lab",
    "url": "https://github.com/sanyoii/cex-market-data-quality-lab",
    "releaseTarget": "Personal portfolio demo - scoped automated acceptance",
    "branch": "main",
    "fullSha": "fc1e0604f96206e1f9dbbc58308031b5ff2f4c4f"
  },
  "objective": "Scoped automated acceptance",
  "environment": "Windows; Python 3.14.2; public Binance market-data endpoints; automated checks only",
  "testedScope": [
    "Unit and REST/WebSocket contract checks",
    "Documentation consistency",
    "Public market-data live integration"
  ],
  "excludedScope": [
    "Human manual testing",
    "Authenticated accounts, orders and funds",
    "Production trading-system certification",
    "Load and production reconnect testing"
  ],
  "releaseAssessment": {
    "status": "ready",
    "rationale": "Owner-approved automated portfolio scope; William self-reviewed with role overlap disclosed. Not independent review, production certification or a new deployment.",
    "decidedAt": "2026-09-06T12:51:34.447Z",
    "expiresAt": "2026-09-07T20:40:00+08:00",
    "qaOwner": "William",
    "reviewer": "William",
    "decisionOwner": "William"
  },
  "summary": {
    "effortLevel": "medium",
    "coverage": "2",
    "quality": "good",
    "comment": "Existing named suites passed; no percentage or exhaustive coverage claim."
  },
  "productAreas": [
    {
      "id": "deterministic",
      "name": "Unit, contract and documentation checks",
      "effortLevel": "medium",
      "executionState": "complete",
      "coverage": "2",
      "targetCoverage": "2",
      "quality": "good",
      "comment": "40 checks passed in the final named suite attempt; limited to approved automated scope.",
      "evidenceLinks": [
        "/run-records/#RUN-20260906-cex-deterministic-1"
      ]
    },
    {
      "id": "live",
      "name": "Public market-data integration",
      "effortLevel": "medium",
      "executionState": "complete",
      "coverage": "2",
      "targetCoverage": "2",
      "quality": "good",
      "comment": "5 checks passed in the final named suite attempt; limited to approved automated scope.",
      "evidenceLinks": [
        "/run-records/#RUN-20260906-cex-live-1"
      ]
    }
  ],
  "gates": [
    {
      "id": "G1",
      "title": "Automated scope accepted",
      "state": "complete",
      "note": "Explicit exclusions retained"
    },
    {
      "id": "G3",
      "title": "Required automated suites passed",
      "state": "complete",
      "note": "Earlier blocked attempt retained where applicable"
    },
    {
      "id": "G6",
      "title": "Owner self-review recorded",
      "state": "complete",
      "note": "William; overlapping roles disclosed; not independent review"
    }
  ],
  "runs": [
    {
      "runId": "RUN-20260906-cex-deterministic-1",
      "executedAt": "2026-09-06T12:40:02.275Z",
      "evidenceUrl": "/run-records/#RUN-20260906-cex-deterministic-1"
    },
    {
      "runId": "RUN-20260906-cex-live-1",
      "executedAt": "2026-09-06T12:40:37.272Z",
      "evidenceUrl": "/run-records/#RUN-20260906-cex-live-1"
    }
  ],
  "provenance": {
    "generatedAt": "2026-09-06T12:51:34.447Z",
    "syncedAt": "2026-09-06T12:51:34.447Z",
    "sourceSha": "fc1e0604f96206e1f9dbbc58308031b5ff2f4c4f"
  },
  "dataStatus": "fresh",
  "publicDisclosure": "public"
}
