{
  "contractVersion": "1.0.0",
  "snapshotId": "cex-0.1.0-8fd5081-20260831-stale",
  "repository": {
    "name": "cex-market-data-quality-lab",
    "url": "https://github.com/sanyoii/cex-market-data-quality-lab",
    "releaseTarget": "0.1.0",
    "branch": "main",
    "fullSha": "8fd5081254b5429e480ec20a56ef09bcc6f5ab9e"
  },
  "objective": "Release Readiness",
  "environment": "Windows; Python 3.14.2; Binance public market-data endpoints",
  "testedScope": [
    "unit",
    "REST contract",
    "WebSocket contract",
    "order-book sync",
    "live market data",
    "manual evidence review"
  ],
  "excludedScope": [
    "authenticated account",
    "orders",
    "trades",
    "funds",
    "load testing"
  ],
  "releaseAssessment": {
    "status": "unknown",
    "rationale": "The previous Ready assessment expired. Historical runs remain available, but no current release decision is claimed until fresh evidence is reviewed.",
    "decidedAt": "2026-08-31T23:56:31+08:00",
    "expiresAt": "2026-09-07T23:56:31+08:00",
    "qaOwner": "William",
    "reviewer": "Freshness gate review",
    "decisionOwner": "William"
  },
  "summary": {
    "effortLevel": "high",
    "coverage": "2+",
    "quality": "warning",
    "comment": "Historical runs are retained; the current release assessment is Unknown because the evidence expired."
  },
  "productAreas": [
    {
      "id": "deterministic",
      "name": "Deterministic checks",
      "effortLevel": "high",
      "executionState": "complete",
      "coverage": "2+",
      "targetCoverage": "2",
      "quality": "good",
      "comment": "Unit, contract and meta checks passed.",
      "evidenceLinks": [
        "/run-records"
      ]
    },
    {
      "id": "market-data",
      "name": "Live market data",
      "effortLevel": "high",
      "executionState": "complete",
      "coverage": "2",
      "targetCoverage": "2",
      "quality": "good",
      "comment": "Required public-endpoint checks passed.",
      "evidenceLinks": [
        "/run-records"
      ]
    },
    {
      "id": "order-book",
      "name": "Order-book synchronization",
      "effortLevel": "high",
      "executionState": "complete",
      "coverage": "2+",
      "targetCoverage": "2",
      "quality": "good",
      "comment": "Sequence and stale-update paths were exercised.",
      "evidenceLinks": [
        "/run-records"
      ]
    },
    {
      "id": "evidence",
      "name": "Evidence and release decision",
      "effortLevel": "high",
      "executionState": "complete",
      "coverage": "2",
      "targetCoverage": "2",
      "quality": "good",
      "comment": "Historical manual review only. No independent external review or formal Go is on record.",
      "evidenceLinks": [
        "/run-records"
      ]
    }
  ],
  "gates": [
    {
      "id": "G1",
      "title": "範圍已鎖定",
      "note": "Scope complete",
      "state": "complete"
    },
    {
      "id": "G3",
      "title": "測試已通過",
      "note": "3 類測試完成",
      "state": "complete"
    },
    {
      "id": "G5",
      "title": "無獨立外部審查紀錄",
      "note": "示範標籤；repo 沒有 G5 簽核",
      "state": "unknown"
    },
    {
      "id": "G6",
      "title": "非正式 Go",
      "note": "不是簽核，也不是發布授權",
      "state": "unknown"
    },
    {
      "id": "Release",
      "title": "Unknown",
      "note": "Fresh evidence review required",
      "state": "unknown"
    }
  ],
  "runs": [
    {
      "runId": "RUN-20260817T015452830Z-8fd5081254b5-DETERMINISTIC",
      "executedAt": "2026-08-17T09:54:52+08:00",
      "evidenceUrl": "/run-records#RUN-20260817T015452830Z-8fd5081254b5-DETERMINISTIC"
    },
    {
      "runId": "RUN-20260817T015452830Z-8fd5081254b5-LIVE",
      "executedAt": "2026-08-17T09:54:52+08:00",
      "evidenceUrl": "/run-records#RUN-20260817T015452830Z-8fd5081254b5-LIVE"
    },
    {
      "runId": "RUN-20260817T015452830Z-8fd5081254b5-MANUAL",
      "executedAt": "2026-08-17T09:54:52+08:00",
      "evidenceUrl": "/run-records#RUN-20260817T015452830Z-8fd5081254b5-MANUAL"
    }
  ],
  "provenance": {
    "generatedAt": "2026-08-31T15:56:31Z",
    "syncedAt": "2026-08-31T15:56:31Z",
    "sourceSha": "8fd5081254b5429e480ec20a56ef09bcc6f5ab9e"
  },
  "dataStatus": "stale",
  "publicDisclosure": "public"
}
