{
  "contractVersion": "1.0.0",
  "snapshotId": "portfolio-pages-fd337bd-20260831-stale",
  "repository": {
    "name": "sanyoii.github.io",
    "url": "https://github.com/sanyoii/sanyoii.github.io",
    "releaseTarget": "GitHub Pages production",
    "branch": "main",
    "fullSha": "fd337bd45bba4a10c370da1364b1e37a7ef5732f"
  },
  "objective": "Deployment Confidence",
  "environment": "GitHub Pages Actions; Python 3.14; Chromium; Node.js 24",
  "testedScope": [
    "static HTML",
    "runtime behavior",
    "responsive layouts",
    "bilingual behavior",
    "reduced motion",
    "404 page"
  ],
  "excludedScope": [
    "cross-browser beyond Chromium",
    "performance",
    "scheduled monitoring",
    "analytics"
  ],
  "releaseAssessment": {
    "status": "unknown",
    "rationale": "The previous Ready assessment expired. Historical runs remain available, but no current release decision is claimed until fresh evidence is reviewed.",
    "decidedAt": "2026-08-31T23:56:31+08:00",
    "expiresAt": "2026-09-07T23:56:31+08:00",
    "qaOwner": "William",
    "reviewer": "Freshness gate review",
    "decisionOwner": "William"
  },
  "summary": {
    "effortLevel": "medium",
    "coverage": "2+",
    "quality": "warning",
    "comment": "Historical runs are retained; the current release assessment is Unknown because the evidence expired."
  },
  "productAreas": [
    {
      "id": "document",
      "name": "Document integrity and privacy",
      "effortLevel": "medium",
      "executionState": "complete",
      "coverage": "2",
      "targetCoverage": "2",
      "quality": "good",
      "comment": "Structure, URL allowlist and phone-data checks passed.",
      "evidenceLinks": [
        "https://github.com/sanyoii/sanyoii.github.io/actions/runs/32241879480"
      ]
    },
    {
      "id": "responsive",
      "name": "Responsive layout",
      "effortLevel": "medium",
      "executionState": "complete",
      "coverage": "2+",
      "targetCoverage": "2",
      "quality": "good",
      "comment": "375, 768 and 1440 px overflow checks passed.",
      "evidenceLinks": [
        "https://github.com/sanyoii/sanyoii.github.io/actions/runs/32241879480"
      ]
    },
    {
      "id": "bilingual",
      "name": "Bilingual behavior",
      "effortLevel": "medium",
      "executionState": "complete",
      "coverage": "2+",
      "targetCoverage": "2",
      "quality": "good",
      "comment": "Language toggle, metadata and persisted state passed.",
      "evidenceLinks": [
        "https://github.com/sanyoii/sanyoii.github.io/actions/runs/32241879480"
      ]
    },
    {
      "id": "runtime",
      "name": "Runtime and accessibility behavior",
      "effortLevel": "medium",
      "executionState": "complete",
      "coverage": "2",
      "targetCoverage": "2",
      "quality": "good",
      "comment": "No external requests, reduced motion and 404 behavior passed.",
      "evidenceLinks": [
        "https://github.com/sanyoii/sanyoii.github.io/actions/runs/32241879480"
      ]
    }
  ],
  "gates": [
    {
      "id": "G1",
      "title": "測試範圍已定義",
      "note": "TESTPLAN.md · 12 checks",
      "state": "complete"
    },
    {
      "id": "G3",
      "title": "17 fresh cases passed",
      "note": "Python 3.14.2 · Chromium",
      "state": "complete"
    },
    {
      "id": "G5",
      "title": "Test-gated build passed",
      "note": "CI checks only; not an external sign-off",
      "state": "complete"
    },
    {
      "id": "G6",
      "title": "Pages routes checked",
      "note": "HTTP checks only; not a formal Go",
      "state": "complete"
    },
    {
      "id": "Release",
      "title": "Unknown",
      "note": "Fresh evidence review required",
      "state": "unknown"
    }
  ],
  "runs": [
    {
      "runId": "32241879480",
      "executedAt": "2026-08-19T18:16:35+08:00",
      "evidenceUrl": "https://github.com/sanyoii/sanyoii.github.io/actions/runs/32241879480"
    },
    {
      "runId": "32241747124",
      "executedAt": "2026-08-19T18:15:01+08:00",
      "evidenceUrl": "https://github.com/sanyoii/RiskQADemoSite/actions/runs/32241747124"
    }
  ],
  "provenance": {
    "generatedAt": "2026-08-31T15:56:31Z",
    "syncedAt": "2026-08-31T15:56:31Z",
    "sourceSha": "fd337bd45bba4a10c370da1364b1e37a7ef5732f"
  },
  "dataStatus": "stale",
  "publicDisclosure": "public"
}
